{
  "schemaVersion": "1.0",
  "id": "x",
  "name": "X",
  "version": "0.1.0",
  "description": "Animated X logo with a crisp entrance and a slow scale breath punctuated by one sharp rotate tick.",
  "asset": { "svg": "./assets/main.svg" },
  "motion": {
    "targets": "./motion/targets.json",
    "timelines": "./motion/timelines.json",
    "states": "./motion/states.json"
  },
  "accessibility": {
    "title": "X",
    "description": "The X logo breathing slowly with a single crisp rotate tick, settling back to rest.",
    "decorative": false
  },
  "reducedMotion": { "strategy": "static", "fallbackState": "idle" }
}
