{
  "schemaVersion": "1.0",
  "id": "close",
  "name": "Close",
  "version": "0.1.0",
  "description": "Animated close icon with a slow quarter-turn tick loop.",
  "asset": {
    "svg": "./assets/main.svg"
  },
  "motion": {
    "targets": "./motion/targets.json",
    "timelines": "./motion/timelines.json",
    "states": "./motion/states.json"
  },
  "accessibility": {
    "title": "Close",
    "description": "An X icon that ticks a quarter turn and back with a paused rhythm.",
    "decorative": false
  },
  "reducedMotion": {
    "strategy": "static",
    "fallbackState": "idle"
  }
}
