{
  "schemaVersion": "1.0",
  "id": "local-shipping",
  "name": "Local Shipping",
  "version": "0.1.0",
  "description": "Animated delivery truck: a road-jiggle bounce, en route.",
  "asset": {
    "svg": "./assets/main.svg"
  },
  "motion": {
    "targets": "./motion/targets.json",
    "timelines": "./motion/timelines.json",
    "states": "./motion/states.json"
  },
  "accessibility": {
    "title": "Delivery",
    "description": "A delivery truck that bounces gently on its suspension, as if driving en route.",
    "decorative": false
  },
  "reducedMotion": {
    "strategy": "static",
    "fallbackState": "idle"
  }
}
