{
  "schemaVersion": "1.0",
  "id": "check-circle-outline",
  "name": "Check Circle Outline",
  "version": "0.1.0",
  "description": "Outlined success check with a soft verified swell and long rest.",
  "asset": {
    "svg": "./assets/main.svg"
  },
  "motion": {
    "targets": "./motion/targets.json",
    "timelines": "./motion/timelines.json",
    "states": "./motion/states.json"
  },
  "accessibility": {
    "title": "Success",
    "description": "An outlined check-in-a-circle that softly swells to confirm success.",
    "decorative": false
  },
  "reducedMotion": {
    "strategy": "static",
    "fallbackState": "idle"
  }
}
